{
  "schemaVersion": "2.2.0",
  "types": [
    "types.yaml"
  ],
  "kinds": [
    "kinds.yaml"
  ],
  "tags": [
    "tags/AbsorbBlasterAbility.yaml",
    "tags/Action.yaml",
    "tags/AIGoalProposalFunction.yaml",
    "tags/AIGoalType.yaml",
    "tags/AIPersonalityData.yaml",
    "tags/ArcSweepAttackAbility.yaml",
    "tags/AttackAction.yaml",
    "tags/AudioConstants.yaml",
    "tags/BaseDestructionAbility.yaml",
    "tags/BattlefieldModifierAbility.yaml",
    "tags/BerserkerAbility.yaml",
    "tags/BinkMovie.yaml",
    "tags/BlackMarketAbility.yaml",
    "tags/BlackMarketItem.yaml",
    "tags/BlastAbility.yaml",
    "tags/BountyOnFactionAbility.yaml",
    "tags/BuzzDroidsAbility.yaml",
    "tags/CableAttackAbility.yaml",
    "tags/Campaign.yaml",
    "tags/ClusterBombAbility.yaml",
    "tags/CombatBonusAbility.yaml",
    "tags/CommandBarComponent.yaml",
    "tags/ConcentrateFireAttackAbility.yaml",
    "tags/CorruptionAbility.yaml",
    "tags/CorruptPlanetAbility.yaml",
    "tags/CorruptSystemsAbility.yaml",
    "tags/DemolitionAbility.yaml",
    "tags/DetectHeroAbility.yaml",
    "tags/DifficultyAdjustment.yaml",
    "tags/DrainLifeAbility.yaml",
    "tags/Draw3DTextCrawl.yaml",
    "tags/DynamicTrackFX.yaml",
    "tags/EarthquakeAttackAbility.yaml",
    "tags/EatAttackAbility.yaml",
    "tags/EliminateHeroAbility.yaml",
    "tags/EnableAbility.yaml",
    "tags/EnableRadarAbility.yaml",
    "tags/EnergyWeaponAttackAbility.yaml",
    "tags/EnhanceDefenseAbility.yaml",
    "tags/Faction.yaml",
    "tags/FindWeaknessAbility.yaml",
    "tags/FlareType.yaml",
    "tags/ForceCloakAbility.yaml",
    "tags/ForceConfuseAbility.yaml",
    "tags/ForceHealingAbility.yaml",
    "tags/ForceLightningAbility.yaml",
    "tags/ForceSightAbility.yaml",
    "tags/ForceTelekinesisAbility.yaml",
    "tags/ForceWhirlwindAbility.yaml",
    "tags/GalacticSabotageAbility.yaml",
    "tags/GalacticStealthAbility.yaml",
    "tags/GalaxyWideUpgradeAbility.yaml",
    "tags/GameConstants.yaml",
    "tags/GameObjectType.yaml",
    "tags/GarrisonUpgradeAbility.yaml",
    "tags/GenericAttackAbility.yaml",
    "tags/GraphicDetailHardwareProfile.yaml",
    "tags/GraphicDetailSetting.yaml",
    "tags/GrenadeAttackAbility.yaml",
    "tags/HackAbility.yaml",
    "tags/HackSuperWeaponAbility.yaml",
    "tags/HardPoint.yaml",
    "tags/HeroAssassinAbility.yaml",
    "tags/HeroClashType.yaml",
    "tags/HeroProtectionAbility.yaml",
    "tags/IncomeStreamAbility.yaml",
    "tags/IncomeStreamModAbility.yaml",
    "tags/InfectionAbility.yaml",
    "tags/IonCannonShotAttackAbility.yaml",
    "tags/LaserDefenseAbility.yaml",
    "tags/LeechShieldsAbility.yaml",
    "tags/LightningTypeManager.yaml",
    "tags/LightSource.yaml",
    "tags/LuckyShotAttackAbility.yaml",
    "tags/MaximumFirepowerAttackAbility.yaml",
    "tags/MousePointerData.yaml",
    "tags/MoveAction.yaml",
    "tags/MusicEvent.yaml",
    "tags/NeutralizeHeroAbility.yaml",
    "tags/PermanentWeaponSwapAbility.yaml",
    "tags/PersonalFlameThrowerAbility.yaml",
    "tags/PlanetIncomeBonusAbility.yaml",
    "tags/PlanetIncomeGamblingAbility.yaml",
    "tags/PoliticalControlBonusAbility.yaml",
    "tags/PoliticalTransitionBonusAbility.yaml",
    "tags/ProximityMinesAbility.yaml",
    "tags/RadarMap.yaml",
    "tags/RadioactiveContaminateAbility.yaml",
    "tags/RedirectBlasterAbility.yaml",
    "tags/ReduceProductionPriceAbility.yaml",
    "tags/ReduceProductionTimeAbility.yaml",
    "tags/ReduceTechnologyPriceAbility.yaml",
    "tags/RemoteBombAbility.yaml",
    "tags/RemoveCorruptionAbility.yaml",
    "tags/RepairAbility.yaml",
    "tags/RetreatProtectionAbility.yaml",
    "tags/SaberThrowAbility.yaml",
    "tags/SabotagePoliticalControlAbility.yaml",
    "tags/SensorJammingAbility.yaml",
    "tags/SFXEvent.yaml",
    "tags/ShieldFlareAbility.yaml",
    "tags/SiphonCreditsAbility.yaml",
    "tags/SlicerAbility.yaml",
    "tags/SpawnAbility.yaml",
    "tags/SpecialAbility.yaml",
    "tags/SpecialAbilityAction.yaml",
    "tags/SpecialAbilityData.yaml",
    "tags/SpeechEvent.yaml",
    "tags/StealthAbility.yaml",
    "tags/StoryParser.yaml",
    "tags/StoryPlotManifest.yaml",
    "tags/StunAbility.yaml",
    "tags/SummonAbility.yaml",
    "tags/SuperLaserAbility.yaml",
    "tags/SystemSpyAbility.yaml",
    "tags/TacticalBribeAbility.yaml",
    "tags/TacticalCameraConstants.yaml",
    "tags/TargetingPrioritySet.yaml",
    "tags/TerrainDecalFX.yaml",
    "tags/TractorBeamAttackAbility.yaml",
    "tags/TradeRoute.yaml",
    "tags/TradeRouteLines.yaml",
    "tags/UnitAbility.yaml",
    "tags/VehicleThiefAbility.yaml",
    "tags/WeatherAudioManager.yaml",
    "tags/WeatherPattern.yaml",
    "tags/WeatherproofAbility.yaml"
  ],
  "enums": [
    "enums/AbilityFlagType.yaml",
    "enums/AbilityMultiplierType.yaml",
    "enums/ActionRelevanceType.yaml",
    "enums/AIGoalApplicationTarget.yaml",
    "enums/AIGoalCategoryType.yaml",
    "enums/AIGoalReachability.yaml",
    "enums/AnimationType.yaml",
    "enums/ArmorType.yaml",
    "enums/AutoresolveExclusionMode.yaml",
    "enums/BattleResultType.yaml",
    "enums/CollisionClassType.yaml",
    "enums/ContainerArrangement.yaml",
    "enums/CorruptionMissionType.yaml",
    "enums/CorruptionType.yaml",
    "enums/DamageType.yaml",
    "enums/ForceAlignment.yaml",
    "enums/FormationGrouping.yaml",
    "enums/GalacticAbilitySlot.yaml",
    "enums/GalacticVictoryCondition.yaml",
    "enums/GameObjectCategoryType.yaml",
    "enums/GameObjectPropertiesType.yaml",
    "enums/HardPointType.yaml",
    "enums/HeroClashMoveType.yaml",
    "enums/HeroClashTypeEnum.yaml",
    "enums/LightEffectType.yaml",
    "enums/MapEnvironment.yaml",
    "enums/MovementClassType.yaml",
    "enums/ObjectWeatherCategoryType.yaml",
    "enums/PassabilityLayerType.yaml",
    "enums/PerceptionTokenType.yaml",
    "enums/PlanetStatisticsType.yaml",
    "enums/ProjectileCategory.yaml",
    "enums/RenderMode.yaml",
    "enums/SellableType.yaml",
    "enums/ShipClassType.yaml",
    "enums/SkirmishWinCondition.yaml",
    "enums/SpaceLayerType.yaml",
    "enums/SpecialAbilityActivationStyle.yaml",
    "enums/StoryBattleMode.yaml",
    "enums/StoryCommandBarRegion.yaml",
    "enums/StoryContainmentFilter.yaml",
    "enums/StoryDialogCommand.yaml",
    "enums/StoryEventFilter.yaml",
    "enums/StoryEventType.yaml",
    "enums/StoryFlagCompareMethod.yaml",
    "enums/StoryGenericTriggerType.yaml",
    "enums/StoryPlanetGuiFlashElement.yaml",
    "enums/StoryPlanetVisibilityModifier.yaml",
    "enums/StoryRewardType.yaml",
    "enums/StoryTutorialEventType.yaml",
    "enums/SurfaceFXTriggerType.yaml",
    "enums/TacticalGameMode.yaml",
    "enums/TacticalProductionQueue.yaml",
    "enums/TerrainType.yaml"
  ],
  "hardcoded": [
    "hardcoded/AbilityClass.yaml",
    "hardcoded/AbilityType.yaml",
    "hardcoded/BehaviorModule.yaml"
  ],
  "meta": [
    "meta/metafiles.yaml"
  ],
  "baselineHash": "ce37f8ccc0afadb7ce0306e3f5d069746f69906074b459da9b6d26822519c2b7"
}
